title,url,time_published,authors,summary,banner_image,source,category_within_source,source_domain,topics,overall_sentiment_score,overall_sentiment_label,ticker_sentiment
"""Microsoft: The Third Pillar""  ( The Emerging Opportunity For MSFT From Generative AI )  - Microsoft  ( NASDAQ:MSFT ) ",https://www.benzinga.com/23/07/33473086/microsoft-the-third-pillar-the-emerging-opportunity-for-msft-from-generative-ai,20230731T154403,['The Science Of Hitting'],"Microsoft MSFT Office revenues reached ~$49 billion in FY2023 ( up ~70% from FY2018 ). Office 365 Commercial now has ~400 million paid seats, up >100% from yearend FY2018. Ongoing strength in paid seats ( volumes ) , at +11% YoY in Q4 FY2023, was led by SMB's and frontline workers.",https://cdn.benzinga.com/files/turag-photography-1uqe5biih8w-unsplash_4.jpg?width=1200&height=800&fit=crop,Benzinga,Markets,www.benzinga.com,"[{'topic': 'Technology', 'relevance_score': '1.0'}, {'topic': 'Financial Markets', 'relevance_score': '0.108179'}]",0.349178,Somewhat-Bullish,"[{'ticker': 'MSFT', 'relevance_score': '0.62382', 'ticker_sentiment_score': '0.519598', 'ticker_sentiment_label': 'Bullish'}]"
Black Tech Street Announces Alliance with Microsoft to Digitally Transform Historic Greenwood,https://www.prnewswire.com/news-releases/black-tech-street-announces-alliance-with-microsoft-to-digitally-transform-historic-greenwood-301889358.html,20230731T152600,['Black Tech Street'],Alliance supports Black Tech Street's ambition to digitally transform Black Wall Street to Black Tech Street through cyber-centered talent and innovation initiatives,https://mma.prnewswire.com/media/2165946/bts_logo_main__1_Logo.jpg?p=facebook,PR Newswire,n/a,www.prnewswire.com,"[{'topic': 'Technology', 'relevance_score': '1.0'}, {'topic': 'Financial Markets', 'relevance_score': '0.538269'}]",0.369269,Bullish,"[{'ticker': 'MSFT', 'relevance_score': '0.576908', 'ticker_sentiment_score': '0.482485', 'ticker_sentiment_label': 'Bullish'}]"
MSFT: Is Microsoft  ( MSFT )  a Good Buy for August?,https://stocknews.com/news/msft-ffiv-vmw-spns-is-microsoft-msft-a-good-buy-for-august/,20230731T172910,['StockNews.com Staff'],"Microsoft Corporation ( MSFT ) has been at the forefront of the AI-driven tech surge this year, with shares soaring over 40% year-to-date. The optimism surrounding the potential of AI has also stimulated record-breaking growth for the Nasdaq 100 in the first half of the year.",https://stocknews.com/wp-content/uploads/2023/06/Microsoft-sign-on-Vancouver-office-building.jpg,Stocknews.com,n/a,stocknews.com,"[{'topic': 'Earnings', 'relevance_score': '0.980509'}, {'topic': 'Technology', 'relevance_score': '1.0'}, {'topic': 'Financial Markets', 'relevance_score': '0.929393'}]",0.256656,Somewhat-Bullish,"[{'ticker': 'MSFT', 'relevance_score': '0.573953', 'ticker_sentiment_score': '0.304703', 'ticker_sentiment_label': 'Somewhat-Bullish'}, {'ticker': 'TRMNF', 'relevance_score': '0.021897', 'ticker_sentiment_score': '0.16316', 'ticker_sentiment_label': 'Somewhat-Bullish'}, {'ticker': 'VMW', 'relevance_score': '0.043778', 'ticker_sentiment_score': '0.164564', 'ticker_sentiment_label': 'Somewhat-Bullish'}, {'ticker': 'SPNS', 'relevance_score': '0.043778', 'ticker_sentiment_score': '0.164564', 'ticker_sentiment_label': 'Somewhat-Bullish'}]"
Update Your Browser for the Best Barrons.com Experience,https://gillettnews.com/news/update-your-browser-for-the-best-barrons-com-experience-31/28281/,20230731T140913,['Casey Martinez'],"We have detected that you are using Internet Explorer, which may not provide the best experience on our website. We recommend updating to a modern browser for the best Barrons.com experience. Using a modern browser will ensure that you have access to all the features and functionality of our ...",https://gillettnews.com/wp-content/uploads/2023/07/mfrack_realistic_photo_of_man_reading_news_68c37ac5-a5cf-435f-baa4-491c96cdaf80.jpeg,Barrons,n/a,gillettnews.com,"[{'topic': 'Technology', 'relevance_score': '1.0'}, {'topic': 'Financial Markets', 'relevance_score': '0.360215'}]",0.457648,Bullish,"[{'ticker': 'MSFT', 'relevance_score': '0.521465', 'ticker_sentiment_score': '0.40641', 'ticker_sentiment_label': 'Bullish'}, {'ticker': 'GOOG', 'relevance_score': '0.363388', 'ticker_sentiment_score': '0.584661', 'ticker_sentiment_label': 'Bullish'}]"
"Artificial Intelligence Is Being Name-Checked By Tech More Than Ever This Earnings Season - Microsoft  ( NASDAQ:MSFT ) , Alphabet  ( NASDAQ:GOOG ) , Alphabet  ( NASDAQ:GOOGL ) , NVIDIA  ( NASDAQ:NVDA ) , Intel  ( NASDAQ:INTC ) , Advanced Micro Devices  ( NASDAQ:AMD ) , Moody's  ( NYSE:MCO ) , S&P Global  ( NYSE:SPGI ) , Amazon.com  ( NASDAQ:AMZN ) ",https://www.benzinga.com/analyst-ratings/analyst-color/23/07/33477455/artificial-intelligence-is-being-name-checked-by-tech-more-than-ever-this-earnings-,20230731T185647,['Natan Ponieman'],"Artificial intelligence is quickly becoming central to the business strategies of most tech companies. The latest earnings season is setting new records for the presence of AI in management speeches during earnings calls, a new report says.",https://cdn.benzinga.com/files/images/story/2023/benzingaai2023_a_modern_slick_robot_wearing_a_suit_while_giving_6d987ebb-fb29-4a89-a8b6-6af6e9eba3b2.png?width=1200&height=800&fit=crop,Benzinga,General,www.benzinga.com,"[{'topic': 'Retail & Wholesale', 'relevance_score': '0.333333'}, {'topic': 'Financial Markets', 'relevance_score': '0.108179'}, {'topic': 'Manufacturing', 'relevance_score': '0.333333'}, {'topic': 'Earnings', 'relevance_score': '0.795202'}, {'topic': 'Technology', 'relevance_score': '0.333333'}]",0.058593,Neutral,"[{'ticker': 'MSFT', 'relevance_score': '0.427726', 'ticker_sentiment_score': '0.138844', 'ticker_sentiment_label': 'Neutral'}, {'ticker': 'GOOG', 'relevance_score': '0.275867', 'ticker_sentiment_score': '-0.012385', 'ticker_sentiment_label': 'Neutral'}, {'ticker': 'NVDA', 'relevance_score': '0.112269', 'ticker_sentiment_score': '-0.091463', 'ticker_sentiment_label': 'Neutral'}, {'ticker': 'AAPL', 'relevance_score': '0.112269', 'ticker_sentiment_score': '0.0', 'ticker_sentiment_label': 'Neutral'}, {'ticker': 'INTC', 'relevance_score': '0.378777', 'ticker_sentiment_score': '0.134469', 'ticker_sentiment_label': 'Neutral'}, {'ticker': 'AMD', 'relevance_score': '0.167709', 'ticker_sentiment_score': '-0.052936', 'ticker_sentiment_label': 'Neutral'}, {'ticker': 'MCO', 'relevance_score': '0.112269', 'ticker_sentiment_score': '0.049462', 'ticker_sentiment_label': 'Neutral'}, {'ticker': 'SPGI', 'relevance_score': '0.112269', 'ticker_sentiment_score': '0.049462', 'ticker_sentiment_label': 'Neutral'}, {'ticker': 'AMZN', 'relevance_score': '0.112269', 'ticker_sentiment_score': '0.0', 'ticker_sentiment_label': 'Neutral'}]"
"Arista Slays Bears As Earnings Beat Amid Microsoft, Meta Worries",https://www.investors.com/news/technology/anet-stock-arista-earnings-q22023/,20230731T203500,"[""Investor's Business Daily"", 'REINHARDT KRAUSE']","Arista Networks ( ANET ) on Monday reported second-quarter results that topped analyst estimates. ANET stock popped as the company's outlook came in above views, amid investor angst over capital spending plans of customers Microsoft ( MSFT ) and Facebook-parent Meta Platforms ( META ) .",https://www.investors.com/wp-content/uploads/2017/11/Stock-Arista-02-company.jpg,Investors Business Daily,n/a,www.investors.com,"[{'topic': 'Earnings', 'relevance_score': '0.928769'}, {'topic': 'Technology', 'relevance_score': '1.0'}, {'topic': 'Financial Markets', 'relevance_score': '0.99793'}]",0.160072,Somewhat-Bullish,"[{'ticker': 'MSFT', 'relevance_score': '0.382925', 'ticker_sentiment_score': '0.0', 'ticker_sentiment_label': 'Neutral'}, {'ticker': 'META', 'relevance_score': '0.382925', 'ticker_sentiment_score': '0.0', 'ticker_sentiment_label': 'Neutral'}, {'ticker': 'ANET', 'relevance_score': '0.546745', 'ticker_sentiment_score': '0.232799', 'ticker_sentiment_label': 'Somewhat-Bullish'}, {'ticker': 'CSCO', 'relevance_score': '0.197413', 'ticker_sentiment_score': '0.0', 'ticker_sentiment_label': 'Neutral'}, {'ticker': 'JNPR', 'relevance_score': '0.197413', 'ticker_sentiment_score': '0.0', 'ticker_sentiment_label': 'Neutral'}]"
This Is AI's Oppenheimer Moment,https://moneymorning.com/investing/this-is-ais-oppenheimer-moment/,20230731T151142,['Nick Black'],"In 1995, there were a paltry 16 million people connected to the internet. Five years later, this rose to around 300 million. And by 2005, there were more than one billion. It's hard to believe that even with that growth, so many people were skeptical about the value that the internet would bring ...",https://moneymappress.com/wp-content/uploads/2023/07/AI_Mentions_Graphy.png,Money Morning,GoogleRSS,moneymorning.com,"[{'topic': 'Earnings', 'relevance_score': '0.360215'}, {'topic': 'Technology', 'relevance_score': '0.5'}, {'topic': 'Manufacturing', 'relevance_score': '0.5'}]",0.150633,Somewhat-Bullish,"[{'ticker': 'MSFT', 'relevance_score': '0.381755', 'ticker_sentiment_score': '0.131286', 'ticker_sentiment_label': 'Neutral'}, {'ticker': 'NYT', 'relevance_score': '0.079392', 'ticker_sentiment_score': '0.0619', 'ticker_sentiment_label': 'Neutral'}, {'ticker': 'AAPL', 'relevance_score': '0.158', 'ticker_sentiment_score': '-0.074498', 'ticker_sentiment_label': 'Neutral'}]"
Amazon earnings preview: All eyes on retail and AWS growth,https://www.marketwatch.com/story/amazon-earnings-preview-all-eyes-on-retail-and-aws-growth-ca9df6e1,20230731T181600,['Jon Swartz'],"""We view Azure's [deceleration in the third quarter] as a slightly cautious read for AWS especially since AWS started seeing optimization later than Azure,"" an analyst warned last week.",https://images.mktw.net/im-820468/social,MarketWatch,Top Stories,www.marketwatch.com,"[{'topic': 'Retail & Wholesale', 'relevance_score': '0.5'}, {'topic': 'Financial Markets', 'relevance_score': '0.360215'}, {'topic': 'Earnings', 'relevance_score': '0.839681'}, {'topic': 'Technology', 'relevance_score': '0.5'}]",0.144211,Neutral,"[{'ticker': 'MSFT', 'relevance_score': '0.327366', 'ticker_sentiment_score': '0.06261', 'ticker_sentiment_label': 'Neutral'}, {'ticker': 'SHOP', 'relevance_score': '0.221819', 'ticker_sentiment_score': '0.11933', 'ticker_sentiment_label': 'Neutral'}, {'ticker': 'GOOG', 'relevance_score': '0.221819', 'ticker_sentiment_score': '0.084018', 'ticker_sentiment_label': 'Neutral'}, {'ticker': 'AMZN', 'relevance_score': '0.740156', 'ticker_sentiment_score': '0.323519', 'ticker_sentiment_label': 'Somewhat-Bullish'}]"
Upgrade Your Internet Explorer for the Best Barrons.com Experience,https://gillettnews.com/business/upgrade-your-internet-explorer-for-the-best-barrons-com-experience/28706/,20230731T165512,['Stacey Scott'],"To ensure the best experience while using Barrons.com, we recommend updating your browser if you are currently using Internet Explorer. Upgrading to a modern browser will enhance your browsing experience and provide access to the latest features and improvements.",https://gillettnews.com/wp-content/uploads/2023/07/mfrack_realistic_photo_of_man_reading_news_febe4a52-f5a8-4007-ae72-7653d5faab2a.jpeg,Barrons,n/a,gillettnews.com,"[{'topic': 'Technology', 'relevance_score': '1.0'}]",0.407173,Bullish,"[{'ticker': 'MSFT', 'relevance_score': '0.327366', 'ticker_sentiment_score': '0.369284', 'ticker_sentiment_label': 'Bullish'}, {'ticker': 'GOOG', 'relevance_score': '0.167322', 'ticker_sentiment_score': '0.319925', 'ticker_sentiment_label': 'Somewhat-Bullish'}]"
Hackers could be Walmart's new defense vs. cybercrime,https://www.marketwatch.com/story/hackers-could-be-walmarts-new-defense-vs-cybercrime-88283d9,20230731T200300,['Nicole Greenberg'],"Attention hackers: Walmart might be interested in hiring you to fight cybercrime, even if you don't have a college degree ...",https://images.mktw.net/im-826914/social,MarketWatch,Top Stories,www.marketwatch.com,"[{'topic': 'Technology', 'relevance_score': '0.5'}, {'topic': 'Retail & Wholesale', 'relevance_score': '0.5'}]",0.009741,Neutral,"[{'ticker': 'MSFT', 'relevance_score': '0.308891', 'ticker_sentiment_score': '0.295113', 'ticker_sentiment_label': 'Somewhat-Bullish'}, {'ticker': 'GOOG', 'relevance_score': '0.157483', 'ticker_sentiment_score': '0.179347', 'ticker_sentiment_label': 'Somewhat-Bullish'}, {'ticker': 'MA', 'relevance_score': '0.157483', 'ticker_sentiment_score': '0.179347', 'ticker_sentiment_label': 'Somewhat-Bullish'}, {'ticker': 'WMT', 'relevance_score': '0.679474', 'ticker_sentiment_score': '0.034558', 'ticker_sentiment_label': 'Neutral'}]"
"Is ChatGPT 5 Coming Soon? Here's What You Need To Know - Microsoft  ( NASDAQ:MSFT ) , Alphabet  ( NASDAQ:GOOG ) , Apple  ( NASDAQ:AAPL ) ",https://www.benzinga.com/news/23/07/33472490/is-chatgpt-5-coming-soon-heres-what-you-need-to-know,20230731T154855,['Aaron Bry'],"OpenAI, the parent company behind ChatGPT, has filed for a trademark for ChatGPT-5. Trademark lawyer Josh Gerben tweeted about it Monday: OpenAI put artificial intelligence ( AI ) back in the public discourse amid its launch of ChatGPT late last year.",https://cdn.benzinga.com/files/images/story/2023/07/31/chatgpt_shutterstock_2256101481.jpg?width=1200&height=800&fit=crop,Benzinga,General,www.benzinga.com,"[{'topic': 'Technology', 'relevance_score': '1.0'}, {'topic': 'Financial Markets', 'relevance_score': '0.108179'}]",0.198957,Somewhat-Bullish,"[{'ticker': 'MSFT', 'relevance_score': '0.301315', 'ticker_sentiment_score': '0.0', 'ticker_sentiment_label': 'Neutral'}, {'ticker': 'GOOG', 'relevance_score': '0.301315', 'ticker_sentiment_score': '0.0', 'ticker_sentiment_label': 'Neutral'}, {'ticker': 'AAPL', 'relevance_score': '0.301315', 'ticker_sentiment_score': '0.0', 'ticker_sentiment_label': 'Neutral'}]"
Update Your Browser for the Best Barrons.com Experience,https://ts2.space/en/update-your-browser-for-the-best-barrons-com-experience-3/,20230731T170509,['Leokadia Głogulska'],"We've detected that you are using Internet Explorer, and we recommend updating to a modern browser for the best Barrons.com experience. By updating your browser, you can ensure that you have access to all the features and functionality of our website.",https://ts2.space/wp-content/uploads/2023/07/mfrack_photo_of_AI_8744cb0e-2539-4c1d-bb84-cfe11c0245dc.jpeg,Barrons,n/a,ts2.space,"[{'topic': 'Technology', 'relevance_score': '1.0'}]",0.528765,Bullish,"[{'ticker': 'MSFT', 'relevance_score': '0.279015', 'ticker_sentiment_score': '0.580226', 'ticker_sentiment_label': 'Bullish'}, {'ticker': 'GOOG', 'relevance_score': '0.279015', 'ticker_sentiment_score': '0.580226', 'ticker_sentiment_label': 'Bullish'}]"
Dow Jones Futures: 5 Big Earnings Movers,https://www.investors.com/market-trend/stock-market-today/dow-jones-futures-microsoft-tesla-stock-new-buy-points-big-earnings-movers/,20230731T211700,"[""Investor's Business Daily"", 'SCOTT LEHTONEN']","Dow Jones Futures: Microsoft, Tesla Stock Could See New Buy Points. 5 Big Earnings Movers Investor's Business Daily ...",https://www.investors.com/wp-content/uploads/2018/12/Stock-TeslaPasadena-01-shut.jpg,Investors Business Daily,n/a,www.investors.com,"[{'topic': 'Financial Markets', 'relevance_score': '1.0'}, {'topic': 'Manufacturing', 'relevance_score': '0.333333'}, {'topic': 'Earnings', 'relevance_score': '0.576289'}, {'topic': 'Technology', 'relevance_score': '0.333333'}, {'topic': 'Finance', 'relevance_score': '0.333333'}]",0.223859,Somewhat-Bullish,"[{'ticker': 'MSFT', 'relevance_score': '0.235062', 'ticker_sentiment_score': '0.266504', 'ticker_sentiment_label': 'Somewhat-Bullish'}, {'ticker': 'XPEV', 'relevance_score': '0.118842', 'ticker_sentiment_score': '0.152561', 'ticker_sentiment_label': 'Somewhat-Bullish'}, {'ticker': 'AAPL', 'relevance_score': '0.235062', 'ticker_sentiment_score': '-0.054331', 'ticker_sentiment_label': 'Neutral'}, {'ticker': 'AVGO', 'relevance_score': '0.158', 'ticker_sentiment_score': '0.223034', 'ticker_sentiment_label': 'Somewhat-Bullish'}, {'ticker': 'TSLA', 'relevance_score': '0.19677', 'ticker_sentiment_score': '0.166399', 'ticker_sentiment_label': 'Somewhat-Bullish'}, {'ticker': 'NIO', 'relevance_score': '0.118842', 'ticker_sentiment_score': '0.152561', 'ticker_sentiment_label': 'Somewhat-Bullish'}, {'ticker': 'MS', 'relevance_score': '0.039745', 'ticker_sentiment_score': '-0.225009', 'ticker_sentiment_label': 'Somewhat-Bearish'}, {'ticker': 'CAT', 'relevance_score': '0.158', 'ticker_sentiment_score': '0.128399', 'ticker_sentiment_label': 'Neutral'}, {'ticker': 'LI', 'relevance_score': '0.118842', 'ticker_sentiment_score': '0.152561', 'ticker_sentiment_label': 'Somewhat-Bullish'}, {'ticker': 'ALGM', 'relevance_score': '0.118842', 'ticker_sentiment_score': '0.10825', 'ticker_sentiment_label': 'Neutral'}, {'ticker': 'BA', 'relevance_score': '0.158', 'ticker_sentiment_score': '0.078644', 'ticker_sentiment_label': 'Neutral'}]"
Update Your Browser for the Best Barrons.com Experience,https://gillettnews.com/news/update-your-browser-for-the-best-barrons-com-experience-32/29236/,20230731T214109,['Stacey Scott'],"To ensure the best experience on Barrons.com, we recommend updating your browser if you are using Internet Explorer. Internet Explorer is no longer supported and may not display the website correctly.",https://gillettnews.com/wp-content/uploads/2023/07/mfrack_realistic_photo_of_woman_reading_technology_news_26ccdaec-775a-4053-a729-4f82cabe0f50.jpeg,Barrons,n/a,gillettnews.com,"[{'topic': 'Technology', 'relevance_score': '1.0'}]",0.485546,Bullish,"[{'ticker': 'MSFT', 'relevance_score': '0.224903', 'ticker_sentiment_score': '0.493591', 'ticker_sentiment_label': 'Bullish'}, {'ticker': 'GOOG', 'relevance_score': '0.224903', 'ticker_sentiment_score': '0.493591', 'ticker_sentiment_label': 'Bullish'}]"
Update Your Browser for the Best Barrons.com Experience,https://gillettnews.com/business/update-your-browser-for-the-best-barrons-com-experience-30/28261/,20230731T140711,['Casey Martinez'],"We've detected that you are using Internet Explorer. To ensure the best experience on Barrons.com, please update to a modern browser. Using an outdated browser like Internet Explorer can lead to compatibility issues and may prevent you from accessing all the features and functionality of our ...",https://gillettnews.com/wp-content/uploads/2023/07/mfrack_realistic_photo_of_woman_reading_local_website_news_ba161609-25da-4580-b76c-130e5e7eb511.jpeg,Barrons,n/a,gillettnews.com,"[{'topic': 'Technology', 'relevance_score': '1.0'}]",0.550506,Bullish,"[{'ticker': 'MSFT', 'relevance_score': '0.209365', 'ticker_sentiment_score': '0.517233', 'ticker_sentiment_label': 'Bullish'}, {'ticker': 'GOOG', 'relevance_score': '0.209365', 'ticker_sentiment_score': '0.517233', 'ticker_sentiment_label': 'Bullish'}]"
"Market Clubhouse Morning Memo - July 31st, 2023  ( Trade Strategy For SPY, QQQ, AAPL, MSFT, And NVDA )  - Invesco QQQ Trust, Series 1  ( NASDAQ:QQQ ) ",https://www.benzinga.com/23/07/33470957/market-clubhouse-morning-memo-july-31st-2023-trade-strategy-for-spy-qqq-aapl-msft-and-nvda,20230731T142303,['RIPS'],"Good Morning Traders! In today's Market Clubhouse Morning Memo, we will discuss SPY, QQQ, AAPL, MSFT, and NVDA. Our proprietary formula, exclusive to Market Clubhouse, dictates these price levels. This dynamic equation takes into account price, volume, and options flow.",https://cdn.benzinga.com/files/market-clubhouse-morning-memo_34.png?width=1200&height=800&fit=crop,Benzinga,Trading,www.benzinga.com,"[{'topic': 'Financial Markets', 'relevance_score': '0.459462'}, {'topic': 'Manufacturing', 'relevance_score': '0.5'}, {'topic': 'Earnings', 'relevance_score': '0.158519'}, {'topic': 'Technology', 'relevance_score': '0.5'}]",0.173897,Somewhat-Bullish,"[{'ticker': 'MSFT', 'relevance_score': '0.196877', 'ticker_sentiment_score': '0.324045', 'ticker_sentiment_label': 'Somewhat-Bullish'}, {'ticker': 'NVDA', 'relevance_score': '0.196877', 'ticker_sentiment_score': '0.112984', 'ticker_sentiment_label': 'Neutral'}]"
Billionaire Ambani's New York Cricket Team Wins First Ever U.S. Major League Cricket Championship,https://www.forbes.com/sites/willskipworth/2023/07/31/billionaire-ambanis-new-york-cricket-team-wins-first-ever-us-major-league-cricket-championship/,20230731T160809,['William Skipworth'],The inaugural championship brought together teams owned by an Indian billionaire and a group of Indian-American tech executives.,"https://imageio.forbes.com/specials-images/imageserve/64c7dc1cfb18ea5918c6f9a3/0x0.jpg?format=jpg&crop=3510,1973,x40,y0,safe&width=1200",Forbes,Business,www.forbes.com,"[{'topic': 'Technology', 'relevance_score': '1.0'}]",0.259325,Somewhat-Bullish,"[{'ticker': 'MSFT', 'relevance_score': '0.160099', 'ticker_sentiment_score': '0.20646', 'ticker_sentiment_label': 'Somewhat-Bullish'}]"
"Seth Rogen And Bill Gates Discuss Cannabis, Alzheimer And Mental Health In New Podcast - Microsoft  ( NASDAQ:MSFT ) ",https://www.benzinga.com/markets/cannabis/23/07/33482267/seth-rogen-and-bill-gates-discuss-cannabis-alzheimer-and-mental-health-in-new-podcast,20230731T223620,['El Planteo'],"In the first episode of his new podcast, Microsoft MSFT mogul Bill Gates chats with actors Seth Rogen and Lauren Miller about mental health, Alzheimer and cannabis. ""Unconfuse Me"" premiered last Thursday and promises to talk about mental health, marijuana, vegetable meat, the evolution of ...",https://cdn.benzinga.com/files/images/story/2023/07/31/bill.jpg?width=1200&height=800&fit=crop,Benzinga,General,www.benzinga.com,"[{'topic': 'Technology', 'relevance_score': '1.0'}]",0.123645,Neutral,"[{'ticker': 'MSFT', 'relevance_score': '0.15697', 'ticker_sentiment_score': '0.06635', 'ticker_sentiment_label': 'Neutral'}, {'ticker': 'PNPL', 'relevance_score': '0.07887', 'ticker_sentiment_score': '-0.190325', 'ticker_sentiment_label': 'Somewhat-Bearish'}]"
Chinese Equities: 3 Reasons the Worst is Over,https://www.zacks.com/commentary/2130003/chinese-equities-3-reasons-the-worst-is-over,20230731T163400,['Andrew Rocco'],"Chinese equities have been lagging recently. However, they can be some of the most robust when they are trending in the right direction. Is the worst over?",https://staticx-tuner.zacks.com/images/articles/main/d3/31262.jpg,Zacks Commentary,n/a,www.zacks.com,"[{'topic': 'Economy - Monetary', 'relevance_score': '0.310843'}, {'topic': 'Financial Markets', 'relevance_score': '0.972756'}, {'topic': 'Manufacturing', 'relevance_score': '0.5'}, {'topic': 'Earnings', 'relevance_score': '0.682689'}, {'topic': 'Technology', 'relevance_score': '0.5'}]",0.088525,Neutral,"[{'ticker': 'BABA', 'relevance_score': '0.439786', 'ticker_sentiment_score': '0.160784', 'ticker_sentiment_label': 'Somewhat-Bullish'}, {'ticker': 'MSFT', 'relevance_score': '0.153961', 'ticker_sentiment_score': '0.14966', 'ticker_sentiment_label': 'Neutral'}, {'ticker': 'NVDA', 'relevance_score': '0.153961', 'ticker_sentiment_score': '0.14966', 'ticker_sentiment_label': 'Neutral'}, {'ticker': 'TCTZF', 'relevance_score': '0.153961', 'ticker_sentiment_score': '0.073492', 'ticker_sentiment_label': 'Neutral'}, {'ticker': 'BIDU', 'relevance_score': '0.302243', 'ticker_sentiment_score': '0.247208', 'ticker_sentiment_label': 'Somewhat-Bullish'}]"
"The Easiest Way to Remember the ""Magnificent 7"" Stocks -- And Why You Should Care",https://www.fool.com/investing/2023/07/31/mama-ant-helps-you-recall-the-magnificent-7-stocks/,20230731T152900,['Anders Bylund'],Crack the code of the market leaders in 2023 with this fun and straightforward guide. Warning: It's unforgettable.,https://g.foolcdn.com/image/?url=https%3A%2F%2Fg.foolcdn.com%2Feditorial%2Fimages%2F741378%2Fcarefree-seniors-having-fun-on-rollercoaster-at-amusement-park.jpg&op=resize&h=340,Motley Fool,n/a,www.fool.com,"[{'topic': 'Retail & Wholesale', 'relevance_score': '0.25'}, {'topic': 'Financial Markets', 'relevance_score': '0.796627'}, {'topic': 'Manufacturing', 'relevance_score': '0.25'}, {'topic': 'Technology', 'relevance_score': '0.25'}, {'topic': 'Finance', 'relevance_score': '0.25'}]",0.229101,Somewhat-Bullish,"[{'ticker': 'MSFT', 'relevance_score': '0.141171', 'ticker_sentiment_score': '0.145154', 'ticker_sentiment_label': 'Neutral'}, {'ticker': 'META', 'relevance_score': '0.09439', 'ticker_sentiment_score': '-0.092111', 'ticker_sentiment_label': 'Neutral'}, {'ticker': 'NVDA', 'relevance_score': '0.141171', 'ticker_sentiment_score': '0.145154', 'ticker_sentiment_label': 'Neutral'}, {'ticker': 'AAPL', 'relevance_score': '0.09439', 'ticker_sentiment_score': '-0.092111', 'ticker_sentiment_label': 'Neutral'}, {'ticker': 'TSLA', 'relevance_score': '0.09439', 'ticker_sentiment_score': '-0.092111', 'ticker_sentiment_label': 'Neutral'}, {'ticker': 'BAC', 'relevance_score': '0.047278', 'ticker_sentiment_score': '0.163358', 'ticker_sentiment_label': 'Somewhat-Bullish'}, {'ticker': 'BRK-A', 'relevance_score': '0.047278', 'ticker_sentiment_score': '0.06877', 'ticker_sentiment_label': 'Neutral'}, {'ticker': 'AMZN', 'relevance_score': '0.09439', 'ticker_sentiment_score': '-0.092111', 'ticker_sentiment_label': 'Neutral'}, {'ticker': 'UNH', 'relevance_score': '0.047278', 'ticker_sentiment_score': '0.06877', 'ticker_sentiment_label': 'Neutral'}]"
